{
    "name": "hello",
    "description": "Print a friendly, customizable greeting.",
    "url": "https://mirror.csclub.uwaterloo.ca/gnu/hello/hello-2.12.2.tar.gz",
    "version": [ 2,12,2 ],
    "depends": [ "bash>=5.3.0" ],
    "build-depends": [],
    "patches": [],
    "bootstrap-commands": [
        [ "${repo_directory}/hello-2.12.2/configure", "--prefix", "${prefix}" ]
    ],
    "build-commands": [
        [ "make", "all" ]
    ],
    "install-commands": [
        [ "make", "install", "DESTDIR=${destdir}" ],
        [ "make", "install", "DESTDIR=${bin_package_prefix}" ]
    ]
}
